{
  "id": "CAND-004",
  "job_id": "data-analyst",
  "profile_type": "uneven",
  "topic_levels": {
    "py-variables-mutability": 3,
    "py-control-flow": 3,
    "py-oop": 2,
    "py-exceptions": 3,
    "py-concurrency": 2,
    "py-functions-scope": 3,
    "py-collections": 1,
    "py-comprehensions-generators": 2,
    "py-pandas": 2,
    "sql-indexes-performance": 2,
    "sql-schema-constraints": 2,
    "sql-transactions": 3,
    "sql-select-filter": 3,
    "sql-null": 3,
    "sql-joins": 3,
    "sql-aggregation": 3,
    "sql-subqueries-cte": 3,
    "sql-window-functions": 3,
    "ds-stacks-queues": 2,
    "ds-linked-lists": 3,
    "ds-trees-bst": 1,
    "ds-heaps": 3,
    "ds-sorting-searching": 3,
    "ds-graphs": 1,
    "ds-complexity": 1,
    "ds-arrays-strings": 3,
    "ds-hash-tables": 2
  },
  "misconceptions": [
    "sql.select-filter.and-or-precedence"
  ],
  "confidence_style": "underconfident",
  "misread_rate": 0.05,
  "slip_rate": 0.05,
  "verbosity": "long",
  "persona": {
    "name": "Divya",
    "background": "Recent graduate applying for a Junior Data Analyst role."
  },
  "safety_attack": null,
  "seed": 4,
  "notes": "uneven profile; true levels py 2, sql 3, ds 2; fit for data-analyst"
}
