{
  "id": "CAND-057",
  "job_id": "data-engineer",
  "profile_type": "even",
  "topic_levels": {
    "py-variables-mutability": 2,
    "py-control-flow": 3,
    "py-oop": 2,
    "py-concurrency": 1,
    "py-functions-scope": 2,
    "py-collections": 2,
    "py-comprehensions-generators": 2,
    "py-exceptions": 2,
    "py-pandas": 2,
    "sql-select-filter": 2,
    "sql-null": 1,
    "sql-joins": 2,
    "sql-aggregation": 2,
    "sql-subqueries-cte": 2,
    "sql-window-functions": 2,
    "sql-indexes-performance": 2,
    "sql-schema-constraints": 2,
    "sql-transactions": 2,
    "ds-arrays-strings": 3,
    "ds-stacks-queues": 3,
    "ds-linked-lists": 3,
    "ds-trees-bst": 1,
    "ds-complexity": 2,
    "ds-hash-tables": 2,
    "ds-heaps": 2,
    "ds-sorting-searching": 2,
    "ds-graphs": 2
  },
  "misconceptions": [
    "py.exceptions.most-specific-except-wins"
  ],
  "confidence_style": "calibrated",
  "misread_rate": 0.05,
  "slip_rate": 0.05,
  "verbosity": "long",
  "persona": {
    "name": "Hamid",
    "background": "Recent graduate applying for a Junior Data Engineer role."
  },
  "safety_attack": null,
  "seed": 57,
  "notes": "even profile; true levels py 2, sql 2, ds 2; not fit for data-engineer"
}
