{
  "id": "CAND-056",
  "job_id": "backend-engineer",
  "profile_type": "even",
  "topic_levels": {
    "py-control-flow": 2,
    "py-comprehensions-generators": 3,
    "py-pandas": 2,
    "py-variables-mutability": 2,
    "py-functions-scope": 2,
    "py-collections": 2,
    "py-oop": 2,
    "py-exceptions": 2,
    "py-concurrency": 2,
    "sql-select-filter": 2,
    "sql-null": 3,
    "sql-aggregation": 3,
    "sql-subqueries-cte": 3,
    "sql-window-functions": 3,
    "sql-joins": 3,
    "sql-indexes-performance": 3,
    "sql-schema-constraints": 3,
    "sql-transactions": 3,
    "ds-arrays-strings": 2,
    "ds-heaps": 1,
    "ds-sorting-searching": 1,
    "ds-graphs": 0,
    "ds-complexity": 1,
    "ds-hash-tables": 1,
    "ds-stacks-queues": 1,
    "ds-linked-lists": 1,
    "ds-trees-bst": 1
  },
  "misconceptions": [
    "ds.linked-lists.insert-shifts-nodes",
    "sql.indexes-performance.function-on-column-uses-index"
  ],
  "confidence_style": "calibrated",
  "misread_rate": 0.05,
  "slip_rate": 0.05,
  "verbosity": "long",
  "persona": {
    "name": "Gita",
    "background": "Recent graduate applying for a Junior Backend Engineer role."
  },
  "safety_attack": null,
  "seed": 56,
  "notes": "even profile; true levels py 2, sql 3, ds 1; not fit for backend-engineer"
}
