{
  "id": "CAND-017",
  "job_id": "backend-engineer",
  "profile_type": "uneven",
  "topic_levels": {
    "py-control-flow": 3,
    "py-comprehensions-generators": 3,
    "py-pandas": 2,
    "py-variables-mutability": 3,
    "py-functions-scope": 3,
    "py-collections": 3,
    "py-oop": 3,
    "py-exceptions": 3,
    "py-concurrency": 3,
    "sql-select-filter": 2,
    "sql-null": 2,
    "sql-aggregation": 2,
    "sql-subqueries-cte": 3,
    "sql-window-functions": 2,
    "sql-joins": 1,
    "sql-indexes-performance": 3,
    "sql-schema-constraints": 3,
    "sql-transactions": 3,
    "ds-arrays-strings": 3,
    "ds-heaps": 3,
    "ds-sorting-searching": 3,
    "ds-graphs": 3,
    "ds-complexity": 3,
    "ds-hash-tables": 3,
    "ds-stacks-queues": 3,
    "ds-linked-lists": 3,
    "ds-trees-bst": 3
  },
  "misconceptions": [
    "ds.complexity.count-loops-for-big-o"
  ],
  "confidence_style": "overconfident",
  "misread_rate": 0.05,
  "slip_rate": 0.05,
  "verbosity": "medium",
  "persona": {
    "name": "Quinn",
    "background": "Recent graduate applying for a Junior Backend Engineer role."
  },
  "safety_attack": null,
  "seed": 17,
  "notes": "uneven profile; true levels py 3, sql 2, ds 3; fit for backend-engineer"
}
