{
  "id": "CAND-049",
  "job_id": "data-analyst",
  "profile_type": "even",
  "topic_levels": {
    "py-variables-mutability": 3,
    "py-control-flow": 3,
    "py-oop": 3,
    "py-exceptions": 3,
    "py-concurrency": 2,
    "py-functions-scope": 3,
    "py-collections": 3,
    "py-comprehensions-generators": 3,
    "py-pandas": 3,
    "sql-indexes-performance": 1,
    "sql-schema-constraints": 3,
    "sql-transactions": 2,
    "sql-select-filter": 2,
    "sql-null": 2,
    "sql-joins": 2,
    "sql-aggregation": 2,
    "sql-subqueries-cte": 2,
    "sql-window-functions": 2,
    "ds-stacks-queues": 0,
    "ds-linked-lists": 2,
    "ds-trees-bst": 1,
    "ds-heaps": 2,
    "ds-sorting-searching": 2,
    "ds-graphs": 0,
    "ds-complexity": 1,
    "ds-arrays-strings": 1,
    "ds-hash-tables": 1
  },
  "misconceptions": [
    "ds.complexity.count-loops-for-big-o"
  ],
  "confidence_style": "overconfident",
  "misread_rate": 0.05,
  "slip_rate": 0.05,
  "verbosity": "medium",
  "persona": {
    "name": "Yash",
    "background": "Recent graduate applying for a Junior Data Analyst role."
  },
  "safety_attack": null,
  "seed": 49,
  "notes": "even profile; true levels py 3, sql 2, ds 1; fit for data-analyst"
}
