{
  "id": "CAND-001",
  "job_id": "data-analyst",
  "profile_type": "uneven",
  "topic_levels": {
    "py-variables-mutability": 2,
    "py-control-flow": 3,
    "py-functions-scope": 2,
    "py-collections": 2,
    "py-comprehensions-generators": 1,
    "py-oop": 1,
    "py-exceptions": 1,
    "py-pandas": 3,
    "py-concurrency": 0,
    "sql-select-filter": 3,
    "sql-null": 1,
    "sql-joins": 2,
    "sql-aggregation": 3,
    "sql-subqueries-cte": 2,
    "sql-window-functions": 1,
    "sql-indexes-performance": 1,
    "sql-schema-constraints": 2,
    "sql-transactions": 0,
    "ds-complexity": 1,
    "ds-arrays-strings": 2,
    "ds-hash-tables": 1,
    "ds-stacks-queues": 1,
    "ds-linked-lists": 1,
    "ds-trees-bst": 0,
    "ds-heaps": 0,
    "ds-sorting-searching": 1,
    "ds-graphs": 0
  },
  "misconceptions": ["sql.joins.left-join-drops-unmatched"],
  "confidence_style": "overconfident",
  "misread_rate": 0.05,
  "slip_rate": 0.05,
  "verbosity": "medium",
  "persona": {
    "name": "Asha",
    "background": "Final-year commerce student who taught herself SQL and pandas for internship dashboards."
  },
  "safety_attack": null,
  "notes": "Strong on everyday pandas and aggregation, weak on NULL handling and window functions; believes LEFT JOIN drops unmatched rows."
}
