{
  "id": "CAND-006",
  "job_id": "data-engineer",
  "profile_type": "uneven",
  "topic_levels": {
    "py-variables-mutability": 2,
    "py-control-flow": 2,
    "py-oop": 3,
    "py-concurrency": 3,
    "py-functions-scope": 3,
    "py-collections": 3,
    "py-comprehensions-generators": 0,
    "py-exceptions": 2,
    "py-pandas": 3,
    "sql-select-filter": 3,
    "sql-null": 3,
    "sql-joins": 3,
    "sql-aggregation": 3,
    "sql-subqueries-cte": 3,
    "sql-window-functions": 3,
    "sql-indexes-performance": 3,
    "sql-schema-constraints": 3,
    "sql-transactions": 3,
    "ds-arrays-strings": 3,
    "ds-stacks-queues": 2,
    "ds-linked-lists": 2,
    "ds-trees-bst": 1,
    "ds-complexity": 3,
    "ds-hash-tables": 0,
    "ds-heaps": 3,
    "ds-sorting-searching": 1,
    "ds-graphs": 3
  },
  "misconceptions": [
    "py.exceptions.most-specific-except-wins",
    "sql.indexes-performance.index-always-helps"
  ],
  "confidence_style": "underconfident",
  "misread_rate": 0.05,
  "slip_rate": 0.05,
  "verbosity": "medium",
  "persona": {
    "name": "Farhan",
    "background": "Recent graduate applying for a Junior Data Engineer role."
  },
  "safety_attack": null,
  "seed": 6,
  "notes": "uneven profile; true levels py 2, sql 3, ds 2; fit for data-engineer"
}
