{
  "id": "CAND-026",
  "job_id": "backend-engineer",
  "profile_type": "even",
  "topic_levels": {
    "py-control-flow": 3,
    "py-comprehensions-generators": 2,
    "py-pandas": 2,
    "py-variables-mutability": 3,
    "py-functions-scope": 3,
    "py-collections": 3,
    "py-oop": 3,
    "py-exceptions": 3,
    "py-concurrency": 3,
    "sql-select-filter": 2,
    "sql-null": 1,
    "sql-aggregation": 2,
    "sql-subqueries-cte": 2,
    "sql-window-functions": 1,
    "sql-joins": 2,
    "sql-indexes-performance": 2,
    "sql-schema-constraints": 2,
    "sql-transactions": 2,
    "ds-arrays-strings": 2,
    "ds-heaps": 3,
    "ds-sorting-searching": 2,
    "ds-graphs": 3,
    "ds-complexity": 3,
    "ds-hash-tables": 3,
    "ds-stacks-queues": 3,
    "ds-linked-lists": 3,
    "ds-trees-bst": 3
  },
  "misconceptions": [
    "ds.complexity.big-o-is-exact-time",
    "ds.hash-tables.lookup-is-linear"
  ],
  "confidence_style": "calibrated",
  "misread_rate": 0.05,
  "slip_rate": 0.05,
  "verbosity": "short",
  "persona": {
    "name": "Zara",
    "background": "Recent graduate applying for a Junior Backend Engineer role."
  },
  "safety_attack": null,
  "seed": 26,
  "notes": "even profile; true levels py 3, sql 2, ds 3; fit for backend-engineer"
}
