{
  "id": "CAND-024",
  "job_id": "data-engineer",
  "profile_type": "uneven",
  "topic_levels": {
    "py-variables-mutability": 1,
    "py-control-flow": 1,
    "py-oop": 1,
    "py-concurrency": 0,
    "py-functions-scope": 0,
    "py-collections": 1,
    "py-comprehensions-generators": 3,
    "py-exceptions": 0,
    "py-pandas": 3,
    "sql-select-filter": 3,
    "sql-null": 3,
    "sql-joins": 3,
    "sql-aggregation": 3,
    "sql-subqueries-cte": 3,
    "sql-window-functions": 3,
    "sql-indexes-performance": 3,
    "sql-schema-constraints": 3,
    "sql-transactions": 3,
    "ds-arrays-strings": 3,
    "ds-stacks-queues": 2,
    "ds-linked-lists": 1,
    "ds-trees-bst": 1,
    "ds-complexity": 1,
    "ds-hash-tables": 3,
    "ds-heaps": 3,
    "ds-sorting-searching": 2,
    "ds-graphs": 3
  },
  "misconceptions": [
    "sql.aggregation.aggregate-in-where",
    "sql.schema-constraints.pk-needs-distinct"
  ],
  "confidence_style": "underconfident",
  "misread_rate": 0.05,
  "slip_rate": 0.05,
  "verbosity": "long",
  "persona": {
    "name": "Ximena",
    "background": "Recent graduate applying for a Junior Data Engineer role."
  },
  "safety_attack": null,
  "seed": 24,
  "notes": "uneven profile; true levels py 1, sql 3, ds 2; not fit for data-engineer"
}
