{
  "id": "CAND-027",
  "job_id": "data-engineer",
  "profile_type": "even",
  "topic_levels": {
    "py-variables-mutability": 1,
    "py-control-flow": 1,
    "py-oop": 2,
    "py-concurrency": 3,
    "py-functions-scope": 2,
    "py-collections": 2,
    "py-comprehensions-generators": 2,
    "py-exceptions": 2,
    "py-pandas": 2,
    "sql-select-filter": 3,
    "sql-null": 3,
    "sql-joins": 3,
    "sql-aggregation": 3,
    "sql-subqueries-cte": 3,
    "sql-window-functions": 3,
    "sql-indexes-performance": 3,
    "sql-schema-constraints": 3,
    "sql-transactions": 3,
    "ds-arrays-strings": 1,
    "ds-stacks-queues": 3,
    "ds-linked-lists": 1,
    "ds-trees-bst": 2,
    "ds-complexity": 2,
    "ds-hash-tables": 2,
    "ds-heaps": 2,
    "ds-sorting-searching": 2,
    "ds-graphs": 2
  },
  "misconceptions": [
    "sql.schema-constraints.normalisation-only-saves-space",
    "sql.subqueries-cte.correlated-runs-once"
  ],
  "confidence_style": "underconfident",
  "misread_rate": 0.05,
  "slip_rate": 0.05,
  "verbosity": "medium",
  "persona": {
    "name": "Aarav",
    "background": "Recent graduate applying for a Junior Data Engineer role."
  },
  "safety_attack": null,
  "seed": 27,
  "notes": "even profile; true levels py 2, sql 3, ds 2; fit for data-engineer"
}
